[
 {
  "atom_id": "crowd-control-mobility.immobilize",
  "family": "crowd-control-mobility",
  "behavior": "EliseSpiderEInitial",
  "trigger": "on_cast",
  "target_policy": "enemy",
  "parameters": {
   "cooldown_rank1": 22.0,
   "cooldown_rank_max": 17.0,
   "range": 700.0,
   "damage_type": null,
   "affects_type_flags": 15567
  },
  "relations": [],
  "provenance": {
   "wiki": [
    "Crowd control",
    "Types of Crowd Control/Summary",
    "Tenacity"
   ],
   "binary": [
    "Characters/Elise/Spells/EliseSpiderEAbility/EliseSpiderEInitial"
   ],
   "evidence": "tag:Trait_SwapsIntoImmobilizingCCAbility"
  }
 },
 {
  "atom_id": "crowd-control-mobility.immobilize",
  "family": "crowd-control-mobility",
  "behavior": "EliseSpiderE",
  "trigger": "on_cast",
  "target_policy": "enemy",
  "parameters": {
   "cooldown_rank1": 23.0,
   "cooldown_rank_max": 17.0,
   "range": 900.0,
   "damage_type": null,
   "affects_type_flags": 7183
  },
  "relations": [],
  "provenance": {
   "wiki": [
    "Crowd control",
    "Types of Crowd Control/Summary",
    "Tenacity"
   ],
   "binary": [
    "Characters/Elise/Spells/EliseSpiderEAbility/EliseSpiderE"
   ],
   "evidence": "tag:Trait_SwapsIntoImmobilizingCCAbility"
  }
 },
 {
  "atom_id": "crowd-control-mobility.slow",
  "family": "crowd-control-mobility",
  "behavior": "EliseSpiderE",
  "trigger": "on_cast",
  "target_policy": "enemy",
  "parameters": {
   "cooldown_rank1": 23.0,
   "cooldown_rank_max": 17.0,
   "range": 900.0,
   "damage_type": null,
   "affects_type_flags": 7183
  },
  "relations": [],
  "provenance": {
   "wiki": [
    "Crowd control",
    "Types of Crowd Control",
    "Types of Crowd Control/Summary",
    "Slow resist",
    "Movement speed",
    "Cleanse",
    "Combat status"
   ],
   "binary": [
    "Characters/Elise/Spells/EliseSpiderEAbility/EliseSpiderE"
   ],
   "evidence": "tag:PositiveEffect_MoveBlock"
  }
 },
 {
  "atom_id": "crowd-control-mobility.untargetable",
  "family": "crowd-control-mobility",
  "behavior": "EliseSpiderE",
  "trigger": "on_cast",
  "target_policy": "self",
  "parameters": {
   "cooldown_rank1": 23.0,
   "cooldown_rank_max": 17.0,
   "range": 900.0,
   "damage_type": null,
   "affects_type_flags": 7183
  },
  "relations": [],
  "provenance": {
   "wiki": [
    "Crowd control"
   ],
   "binary": [
    "Characters/Elise/Spells/EliseSpiderEAbility/EliseSpiderE"
   ],
   "evidence": "tag:Trait_Untargetable"
  }
 },
 {
  "atom_id": "stack-transform-summon-resource.buff",
  "family": "stack-transform-summon-resource",
  "behavior": "EliseSpiderEBuff",
  "trigger": "on_effect",
  "target_policy": "self",
  "parameters": {
   "cooldown_rank1": 210.0,
   "cooldown_rank_max": 30.0,
   "range": 25000.0,
   "damage_type": null,
   "affects_type_flags": 14346
  },
  "relations": [],
  "provenance": {
   "wiki": [
    "Buff"
   ],
   "binary": [
    "Characters/Elise/Spells/EliseSpiderEAbility/EliseSpiderEBuff"
   ],
   "evidence": "name:buff"
  }
 },
 {
  "atom_id": "crowd-control-mobility.immobilize",
  "family": "crowd-control-mobility",
  "behavior": "EliseSpiderEDescent",
  "trigger": "on_effect",
  "target_policy": "enemy",
  "parameters": {
   "cooldown_rank1": 0.0,
   "cooldown_rank_max": 0.0,
   "range": 825.0,
   "damage_type": null,
   "affects_type_flags": 6186
  },
  "relations": [],
  "provenance": {
   "wiki": [
    "Crowd control",
    "Types of Crowd Control/Summary",
    "Tenacity"
   ],
   "binary": [
    "Characters/Elise/Spells/EliseSpiderEAbility/EliseSpiderEDescent"
   ],
   "evidence": "tag:Trait_SwapsIntoImmobilizingCCAbility"
  }
 },
 {
  "atom_id": "damage.basic-attack",
  "family": "damage",
  "behavior": "EliseBasicAttack",
  "trigger": "on_effect",
  "target_policy": "enemy",
  "parameters": {
   "cooldown_rank1": 0.0,
   "cooldown_rank_max": 0.0,
   "range": 300.0,
   "damage_type": null,
   "affects_type_flags": 7375
  },
  "relations": [],
  "provenance": {
   "wiki": [
    "Damage",
    "Attack damage",
    "Attack effects"
   ],
   "binary": [
    "Characters/Elise/Spells/EliseBasicAttack"
   ],
   "evidence": "name:basicattack"
  }
 },
 {
  "atom_id": "damage.tag-basicattack",
  "family": "damage",
  "behavior": "EliseBasicAttack",
  "trigger": "on_effect",
  "target_policy": "enemy",
  "parameters": {
   "cooldown_rank1": 0.0,
   "cooldown_rank_max": 0.0,
   "range": 300.0,
   "damage_type": null,
   "affects_type_flags": 7375
  },
  "relations": [],
  "provenance": {
   "wiki": [
    "Damage",
    "Attack effects"
   ],
   "binary": [
    "Characters/Elise/Spells/EliseBasicAttack"
   ],
   "evidence": "name:basicattack"
  }
 },
 {
  "atom_id": "vision-economy.sight",
  "family": "vision-economy",
  "behavior": "EliseInBrush",
  "trigger": "on_effect",
  "target_policy": "enemy",
  "parameters": {
   "cooldown_rank1": null,
   "cooldown_rank_max": null,
   "range": null,
   "damage_type": null,
   "affects_type_flags": null
  },
  "relations": [],
  "provenance": {
   "wiki": [
    "Sight",
    "Ward",
    "Vision score",
    "Stealth"
   ],
   "binary": [
    "{0e7f91fc}"
   ],
   "evidence": "name:brush"
  }
 },
 {
  "atom_id": "crowd-control-mobility.immobilize",
  "family": "crowd-control-mobility",
  "behavior": "EliseHumanEMissile",
  "trigger": "on_cast",
  "target_policy": "enemy",
  "parameters": {
   "cooldown_rank1": 12.0,
   "cooldown_rank_max": 10.0,
   "range": 1100.0,
   "damage_type": null,
   "affects_type_flags": 6154
  },
  "relations": [],
  "provenance": {
   "wiki": [
    "Crowd control",
    "Types of Crowd Control/Summary",
    "Tenacity"
   ],
   "binary": [
    "{1aba9498}"
   ],
   "evidence": "tag:Trait_ImmobilizingCCSpell"
  }
 },
 {
  "atom_id": "crowd-control-mobility.immobilize",
  "family": "crowd-control-mobility",
  "behavior": "EliseHumanE",
  "trigger": "on_cast",
  "target_policy": "enemy",
  "parameters": {
   "cooldown_rank1": 12.0,
   "cooldown_rank_max": 10.0,
   "range": 1100.0,
   "damage_type": null,
   "affects_type_flags": 6154
  },
  "relations": [],
  "provenance": {
   "wiki": [
    "Crowd control",
    "Types of Crowd Control/Summary",
    "Tenacity"
   ],
   "binary": [
    "Characters/Elise/Spells/EliseHumanEAbility/EliseHumanE"
   ],
   "evidence": "tag:Trait_ImmobilizingCCSpell"
  }
 },
 {
  "atom_id": "damage.damage-instance",
  "family": "damage",
  "behavior": "EliseHumanE",
  "trigger": "on_cast",
  "target_policy": "enemy",
  "parameters": {
   "cooldown_rank1": 12.0,
   "cooldown_rank_max": 10.0,
   "range": 1100.0,
   "damage_type": null,
   "affects_type_flags": 6154
  },
  "relations": [
   "damage.resistance-mitigation",
   "heal-shield.life-steal",
   "heal-shield.omnivamp",
   "heal-shield.grey-health"
  ],
  "provenance": {
   "wiki": [
    "Damage"
   ],
   "binary": [
    "Characters/Elise/Spells/EliseHumanEAbility/EliseHumanE"
   ],
   "evidence": "tag:Trait_Low_Damage"
  }
 },
 {
  "atom_id": "crowd-control-mobility.combat-status",
  "family": "crowd-control-mobility",
  "behavior": "EliseInCombat",
  "trigger": "on_effect",
  "target_policy": "self",
  "parameters": {
   "cooldown_rank1": null,
   "cooldown_rank_max": null,
   "range": null,
   "damage_type": null,
   "affects_type_flags": null
  },
  "relations": [],
  "provenance": {
   "wiki": [
    "Combat status"
   ],
   "binary": [
    "{27bea314}"
   ],
   "evidence": "name:combat"
  }
 },
 {
  "atom_id": "crowd-control-mobility.slow",
  "family": "crowd-control-mobility",
  "behavior": "BuffEliseESlow",
  "trigger": "on_effect",
  "target_policy": "enemy",
  "parameters": {
   "cooldown_rank1": null,
   "cooldown_rank_max": null,
   "range": null,
   "damage_type": null,
   "affects_type_flags": null
  },
  "relations": [],
  "provenance": {
   "wiki": [
    "Crowd control",
    "Types of Crowd Control",
    "Types of Crowd Control/Summary",
    "Slow resist",
    "Movement speed",
    "Cleanse",
    "Combat status"
   ],
   "binary": [
    "Characters/Elise/Spells/BuffEliseESlow"
   ],
   "evidence": "name:slow"
  }
 },
 {
  "atom_id": "stack-transform-summon-resource.buff",
  "family": "stack-transform-summon-resource",
  "behavior": "BuffEliseESlow",
  "trigger": "on_effect",
  "target_policy": "self",
  "parameters": {
   "cooldown_rank1": null,
   "cooldown_rank_max": null,
   "range": null,
   "damage_type": null,
   "affects_type_flags": null
  },
  "relations": [],
  "provenance": {
   "wiki": [
    "Buff"
   ],
   "binary": [
    "Characters/Elise/Spells/BuffEliseESlow"
   ],
   "evidence": "name:buff"
  }
 },
 {
  "atom_id": "crowd-control-mobility.slow",
  "family": "crowd-control-mobility",
  "behavior": "EliseSpiderQ",
  "trigger": "on_cast",
  "target_policy": "enemy",
  "parameters": {
   "cooldown_rank1": 6.0,
   "cooldown_rank_max": 6.0,
   "range": 475.0,
   "damage_type": "magic",
   "affects_type_flags": 6154
  },
  "relations": [],
  "provenance": {
   "wiki": [
    "Crowd control",
    "Types of Crowd Control",
    "Types of Crowd Control/Summary",
    "Slow resist",
    "Movement speed",
    "Cleanse",
    "Combat status"
   ],
   "binary": [
    "Characters/Elise/Spells/EliseSpiderQAbility/EliseSpiderQ"
   ],
   "evidence": "tag:PositiveEffect_MoveBlock"
  }
 },
 {
  "atom_id": "damage.basic-attack",
  "family": "damage",
  "behavior": "EliseSpiderQ",
  "trigger": "on_cast",
  "target_policy": "enemy",
  "parameters": {
   "cooldown_rank1": 6.0,
   "cooldown_rank_max": 6.0,
   "range": 475.0,
   "damage_type": "magic",
   "affects_type_flags": 6154
  },
  "relations": [],
  "provenance": {
   "wiki": [
    "Damage",
    "Attack damage",
    "Attack effects"
   ],
   "binary": [
    "Characters/Elise/Spells/EliseSpiderQAbility/EliseSpiderQ"
   ],
   "evidence": "tag:Trait_Strike"
  }
 },
 {
  "atom_id": "damage.damage-instance",
  "family": "damage",
  "behavior": "EliseSpiderQ",
  "trigger": "on_cast",
  "target_policy": "enemy",
  "parameters": {
   "cooldown_rank1": 6.0,
   "cooldown_rank_max": 6.0,
   "range": 475.0,